{
  "birth": {
    "created_at": "2026-07-12T18:18:52Z",
    "kind": "public-synthetic-product-birth",
    "lineage": "rapp-stack-cubby-clean-room",
    "name": "RAPP Stack Cubby",
    "product_contract": "repository-is-the-product",
    "purpose": "Understand, improve, build, package, hatch, and operate RAPP locally."
  },
  "owner": "kody-w",
  "schema": "rapp-birth/1.0",
  "slug": "rapp-stack-cubby"
}
